{"role":"frontend-dev","task":"food-photo-calories","step":"4","round":3,"status":"done","paths_written":["src/components/CaptureFlow.tsx","src/components/DishEditor.tsx","src/lib/client/meal.ts","src/lib/client/meal.test.ts","src/copy/th.ts"],"ac_ids_done":["AC-1","AC-2","AC-3","AC-4","AC-5","AC-6","AC-7","AC-8","AC-9","AC-10","AC-11","AC-12","AC-13","AC-14","AC-15","AC-16","AC-17","AC-22","AC-23"],"tests":{"passed":180,"total":180},"blockers":[],"quality_checks":{"passed":true,"failed":[]},"brain_note":"H:\\second-brain\\Projects\\calope\\agents\\frontend-dev\\food-photo-calories.md","summary":"M-1: editor refuses a portion whose kcal would exceed 5000 with a Thai message, recalc clamps. M-2: consent check failure now fails closed with retry. L-1 FE: INTERNAL_ERROR with fallback manual shows the manual fallback. npm test 180/180, lint clean, build passes on Node 24.21.0."}
