{
  "role": "backend-dev",
  "task": "food-photo-calories",
  "step": "4",
  "round": 3,
  "status": "done",
  "paths_written": [
    "E:\\projects\\calope-be\\src\\server\\image.ts",
    "E:\\projects\\calope-be\\src\\server\\errors.ts",
    "E:\\projects\\calope-be\\src\\server\\http.ts",
    "E:\\projects\\calope-be\\src\\app\\api\\analyze\\route.ts",
    "E:\\projects\\calope-be\\src\\server\\rate-limit.test.ts"
  ],
  "ac_ids_done": ["AC-1", "AC-2", "AC-3", "AC-4", "AC-7", "AC-8", "AC-10", "AC-11", "AC-12", "AC-13", "AC-14", "AC-16", "AC-17", "AC-18", "AC-19", "AC-20", "AC-21", "AC-23", "AC-24"],
  "tests": { "passed": 181, "total": 185 },
  "blockers": [
    { "id": "B-2", "problem": "No SQL path run against Postgres; advisory-lock concurrency is untested (only operation order is pinned); live Anthropic call not run.", "ac_ids": ["AC-13"], "owner": "Devops" },
    { "id": "B-5", "problem": "4 FE component tests fail (ConsentPanel x3, PortionStepper x1); all BE tests pass.", "file": "src/components/ConsentPanel.test.tsx", "owner": "FE" },
    { "id": "B-6", "problem": "Re-merge into feature/food-photo-calories not done by BE (role rule: no merges); Orchestrator to merge.", "owner": "Architect" }
  ],
  "quality_checks": { "passed": true, "failed": [] },
  "brain_note": "H:\\second-brain\\Projects\\calope\\agents\\backend-dev\\food-photo-calories.md",
  "summary": "M-3 sharp limitInputPixels 40M with test; L-1 INTERNAL_ERROR text per contract and fallback manual on analyze; L-4 transaction order test, concurrency gap documented. Node 24.21.0, tsc clean, BE tests all pass."
}
