{"role":"architect","task":"food-photo-calories","step":"3","round":5,"status":"done","paths_written":["E:\\projects\\calope\\.team\\food-photo-calories\\contract.md","E:\\projects\\calope\\.team\\food-photo-calories\\handoff\\3-architect-r5.json"],"blockers":[{"id":"B-1","problem":"Legal review of ADR 0002 consent wording and USA transfer pending; blocks release, not build","owner":"PM"},{"id":"B-2","problem":"Confirm login provider (Google for MVP) before BE wires auth; ADR 0004 Proposed","owner":"PM"},{"id":"B-3","problem":"Dish pick list for AC-8 has no licensed source; MVP ships free text only, non-blocking","owner":"PM"},{"id":"B-4","problem":"Confirm user-typed dish names showing Thai only satisfies AC-22 after rename, non-blocking","owner":"PM"},{"id":"B-5","problem":"Add superseded_at to consent_records instead of withdrawn_at on new-version consent; delete consent-version.ts re-export once FE file merged","owner":"BE","file":"src/server/consent-version.ts","ac_ids":["AC-15","AC-16","AC-18"]},{"id":"B-6","problem":"Move sharp decode before the rate-limit step so undecodable files are not counted (R1); change FILE_TOO_LARGE text to state the 4 MB post-resize limit (R4)","owner":"BE","file":"src/server/errors.ts","ac_ids":["AC-1","AC-13"]}],"quality_checks":{"passed":true,"failed":[]},"brain_note":"H:\\second-brain\\Projects\\calope\\agents\\architect\\food-photo-calories.md","summary":"Round 5 docs findings: R1 contract stands, BE reorders sharp decode before rate limit. R2 contract changed to size, magic bytes, decode order. R3 non-UUID id 404 confirmed. R4 user limit stays 10 MB client-side, server FILE_TOO_LARGE states its 4 MB limit; BE text change, no FE change."}
