{"role":"architect","task":"food-photo-calories","step":"3","round":1,"status":"done","paths_written":["E:\\projects\\calope\\.team\\food-photo-calories\\contract.md","E:\\projects\\calope\\docs\\adr\\0004-app-stack-postgres-and-auth.md","H:\\second-brain\\Projects\\calope\\agents\\architect\\food-photo-calories.md","E:\\projects\\calope\\.team\\food-photo-calories\\handoff\\3-architect-r1.json"],"blockers":[{"id":"B-1","problem":"Legal review of ADR 0002 consent wording and USA transfer pending; blocks release, not build","owner":"PM"},{"id":"B-2","problem":"Confirm login provider (Google for MVP) before BE wires auth; ADR 0004 Proposed","owner":"PM"}],"quality_checks":{"passed":true,"failed":[]},"brain_note":"H:\\second-brain\\Projects\\calope\\agents\\architect\\food-photo-calories.md","summary":"contract.md written with all 24 ACs mapped. Endpoints: POST /api/analyze, consent GET/POST/DELETE, meals POST/GET/DELETE, health. Postgres plus Auth.js (ADR 0004). Rate limit 20/h confirmed. Runtime matches deploy.md (Node 24.x, Next 16.4.0, SDK 0.132.1). B-1 and B-2 are non-blocking for build."}
