{
  "role": "backend-dev",
  "task": "food-photo-calories",
  "step": "4",
  "round": 4,
  "status": "done",
  "paths_written": ["E:\\projects\\calope-be\\scripts\\check-no-thai-food-data.mjs"],
  "ac_ids_done": ["AC-23"],
  "blockers": [],
  "quality_checks": { "passed": true, "failed": [] },
  "brain_note": "H:\\second-brain\\Projects\\calope\\agents\\backend-dev\\food-photo-calories.md",
  "summary": "AC-23 check no longer skips docs/; script passes on the current tree (includes feature branch merge)."
}
