{"role":"qa-tester","task":"food-photo-calories","step":"7","round":2,"status":"done","verdict":"Pass","paths_written":["E:\\projects\\calope\\.team\\food-photo-calories\\qa-report.md","E:\\projects\\calope-qa\\tests\\fixtures\\contract.ts","E:\\projects\\calope-qa\\tests\\e2e\\api\\errors.test.ts"],"tests":{"passed":237,"total":263},"blockers":[],"quality_checks":{"passed":true,"failed":[]},"brain_note":"H:\\second-brain\\Projects\\calope\\agents\\qa-tester\\food-photo-calories.md","summary":"B-1 verified fixed. FILE_TOO_LARGE expectations match R4 exactly. npm test 187/187. QA suite 237 pass, 0 fail, 26 skipped (21 DB need DATABASE_URL, 5 live/browser/OAuth/AC-24 not-run)."}
