{"role":"devops","task":"food-photo-calories","step":"4","mode":2,"round":5,"status":"done","paths_written":["E:\\projects\\calope\\vitest.config.ts","E:\\projects\\calope\\eslint.config.mjs","E:\\projects\\calope\\package.json","E:\\projects\\calope\\package-lock.json","E:\\projects\\calope\\.team\\food-photo-calories\\handoff\\3-devops-r5.json"],"blockers":[],"quality_checks":{"passed":true,"failed":[]},"summary":"Commit b008a59 on ops: vitest projects config (node for .ts, jsdom for .tsx, @ alias), eslint 9.39.5 flat config with next core-web-vitals and SDK no-restricted-imports, exact pins. Build and lint pass on Node 24.21.0; probe tests passed in both envs. ff-only merge into fe and be refused: branches diverged, not merged."}
