{
  "role": "backend-dev",
  "task": "food-photo-calories",
  "step": "4",
  "round": 5,
  "status": "done",
  "paths_written": [
    "E:\\projects\\calope-be\\src\\app\\api\\analyze\\route.ts",
    "E:\\projects\\calope-be\\src\\server\\errors.ts",
    "E:\\projects\\calope-be\\src\\server\\analyze-route.test.ts"
  ],
  "ac_ids_done": ["AC-1", "AC-13"],
  "tests": { "passed": 182, "total": 186 },
  "blockers": [
    { "id": "B-5", "problem": "4 FE component tests fail (ConsentPanel x3, PortionStepper x1); all BE tests pass.", "file": "src/components/ConsentPanel.test.tsx", "owner": "FE" }
  ],
  "quality_checks": { "passed": true, "failed": [] },
  "brain_note": "H:\\second-brain\\Projects\\calope\\agents\\backend-dev\\food-photo-calories.md",
  "summary": "R1: sharp decode now runs before the rate-limit step; corrupt JPEG returns 400 and uses no slot (test). R4: FILE_TOO_LARGE text updated. Contract B-5 (superseded_at, shim removal) already done in 3adc9fa."
}
