{"role":"frontend-dev","task":"food-photo-calories","step":"4","round":1,"status":"not-ready","paths_written":["src/app/(app)/","src/app/signin/page.tsx","src/app/layout.tsx","src/app/globals.css","src/app/tokens.css","src/components/","src/lib/client/","src/copy/th.ts","src/shared/consent.ts"],"ac_ids_done":["AC-1","AC-2","AC-3","AC-4","AC-5","AC-6","AC-7","AC-8","AC-9","AC-10","AC-11","AC-12","AC-13","AC-14","AC-15","AC-16","AC-17","AC-22","AC-23"],"tests":{"passed":24,"total":24},"blockers":[{"id":"B-1","problem":"3 component tests need jsdom and a vitest config with @ alias; not in repo, so they were not run","owner":"Devops"},{"id":"B-2","problem":"eslint not installed or configured, lint not run","owner":"Devops"}],"quality_checks":{"passed":false,"failed":["component tests not run (no jsdom/config)","lint not run (no eslint config)","typecheck and build ran against a local stub of src/shared/api-types.ts (BE not merged)"]},"brain_note":"H:\\second-brain\\Projects\\calope\\agents\\frontend-dev\\food-photo-calories.md","summary":"FE built on fe/food-photo-calories. Rename clears name_en to null per contract Q7. 24 logic tests pass. not-ready only for devops blockers: jsdom/vitest config (B-1) and eslint (B-2)."}
