{"role":"devops","task":"food-photo-calories","step":"4","mode":2,"round":4,"status":"done","paths_written":["E:\\projects\\calope\\package.json","E:\\projects\\calope\\package-lock.json","E:\\projects\\calope\\.team\\food-photo-calories\\handoff\\3-devops-r4.json"],"blockers":[],"quality_checks":{"passed":true,"failed":[]},"summary":"Step 4 deps added exact, commit 8ed875c. npm run build passes on Node 24.21.0. next-auth is 5.0.0-beta.32 (only v5 line). No vitest config (not devops-owned); jsdom not added. npm audit: 4 moderate (esbuild via drizzle-kit, dev only)."}
