{"role":"qa-tester","task":"food-photo-calories","step":"7","round":1,"status":"not-ready","verdict":"Fail","paths_written":["E:\\projects\\calope\\.team\\food-photo-calories\\qa-report.md","E:\\projects\\calope-qa\\tests\\e2e","E:\\projects\\calope-qa\\tests\\fixtures","H:\\second-brain\\Projects\\calope\\agents\\qa-tester\\food-photo-calories.md"],"ac_ids_done":["AC-1","AC-2","AC-3","AC-4","AC-5","AC-6","AC-7","AC-8","AC-9","AC-10","AC-11","AC-12","AC-13","AC-14","AC-15","AC-16","AC-17","AC-18","AC-19","AC-20","AC-21","AC-22","AC-23","AC-24"],"tests":{"passed":236,"total":263},"blockers":[{"id":"B-1","problem":"Undecodable image with valid JPEG magic bytes consumes a rate-limit event before processImage rejects it with 400; C-RATE says invalid files do not count.","file":"src/app/api/analyze/route.ts:53","ac_ids":["AC-13","AC-1"],"owner":"BE"}],"quality_checks":{"passed":false,"failed":["AC-24 has only skipped stubs (live API and spike data unavailable)","20 DB-backed tests skipped (DATABASE_URL absent), persistence ACs 10/16/17/18 unverified against a real database"]},"brain_note":"H:\\second-brain\\Projects\\calope\\agents\\qa-tester\\food-photo-calories.md","summary":"npm test 186/186. QA suite 263: 236 pass, 1 fail (B-1 rate-limit consumed by corrupt image), 26 skipped (DB needs DATABASE_URL; AC-24, browser, OAuth not-run). AC-19 real build scan clean. Commit 8f7a23f."}
