{"role":"devops","task":"food-photo-calories","step":"3d","mode":2,"round":3,"status":"done","verdict":"Pass","paths_written":["E:\\projects\\calope\\.team\\food-photo-calories\\deploy.md","E:\\projects\\calope\\.team\\food-photo-calories\\handoff\\3-devops-r3.json"],"blockers":[{"id":"B-5","problem":"Live Anthropic call blocked: ANTHROPIC_API_KEY not provided. Named open item for the Human gate, not gating.","owner":"PM"}],"quality_checks":{"passed":true,"failed":[]},"summary":"Smoke Pass on Node 24.21.0: node -v, npm ci, build, /api/health 200 all pass. JPEG 1,228,551 bytes. Live call blocked: key not provided (B-5)."}
