{"role":"product-manager","task":"food-photo-calories","step":"2","round":1,"status":"needs-input","paths_written":["E:\\projects\\calope\\.team\\food-photo-calories\\ac.md","E:\\projects\\calope\\docs\\plan\\food-photo-calories.md","E:\\projects\\calope\\docs\\adr\\0001-vision-model-provider.md","E:\\projects\\calope\\docs\\adr\\0002-photo-storage-and-pdpa-consent.md","E:\\projects\\calope\\docs\\adr\\0003-mvp-scope-estimate-as-editable-range.md","H:\\second-brain\\Projects\\calope\\agents\\product-manager\\food-photo-calories.md"],"blockers":[{"id":"B-1","problem":"ADR 0001 provider/model is a working assumption; user must confirm Anthropic direct + Sonnet 5.5 before step 3d","owner":"PM"},{"id":"B-2","problem":"Legal view needed on USA transfer and 30-day provider retention (ADR 0002)","owner":"PM"}],"quality_checks":{"passed":true,"failed":[]},"brain_note":"H:\\second-brain\\Projects\\calope\\agents\\product-manager\\food-photo-calories.md","summary":"24 ACs, 3-phase plan (P0/P1/P2), ADRs 0001 and 0002 Proposed, 0003 Accepted. Provider pending user confirmation; PDPA retention needs legal review."}
