{"role":"devops","task":"food-photo-calories","step":"4","mode":2,"round":6,"status":"done","paths_written":["E:\\projects\\calope\\package.json","E:\\projects\\calope\\package-lock.json","E:\\projects\\calope\\eslint.config.mjs","E:\\projects\\calope\\.team\\food-photo-calories\\deploy.md","E:\\projects\\calope\\.team\\food-photo-calories\\handoff\\3-devops-r6.json"],"blockers":[],"quality_checks":{"passed":true,"failed":[]},"summary":"tsx 4.23.15 exact; scripts db:generate, db:migrate (scripts/drizzle.config.ts), spike (scripts/spike/run-spike.ts, path read from be branch). ESLint exempts test files from SDK rule. Smoke notes updated (health body, Origin header). Build and lint pass on Node 24.21.0. ff-only merge into fe/be not possible (diverged)."}
