{"role":"devops","task":"food-photo-calories","step":"3d","mode":2,"round":2,"status":"not-ready","verdict":"Fail","paths_written":["E:\\projects\\calope\\package.json","E:\\projects\\calope\\package-lock.json","E:\\projects\\calope\\tsconfig.json","E:\\projects\\calope\\next.config.ts","E:\\projects\\calope\\.gitignore","E:\\projects\\calope\\src\\app\\layout.tsx","E:\\projects\\calope\\src\\app\\page.tsx","E:\\projects\\calope\\src\\app\\api\\health\\route.ts","E:\\projects\\calope\\.team\\food-photo-calories\\deploy.md","H:\\second-brain\\Projects\\calope\\agents\\devops\\food-photo-calories.md"],"blockers":[{"id":"B-6","problem":"Node 24.21.0 not installed locally (Node 22.14.0); check 1 fails and checks 2-4 ran on the wrong runtime.","owner":"Devops"},{"id":"B-5","problem":"Live Anthropic call blocked: ANTHROPIC_API_KEY not provided.","owner":"PM"}],"quality_checks":{"passed":false,"failed":["check 1 Node version","checks 2-4 ran on Node 22 not pin"]},"summary":"Smoke FAIL: Node 22.14 vs pin 24.21.0. Install, build, /api/health 200 pass on Node 22 only. 2000x1500 JPEG 1,228,551 bytes. Live Anthropic call blocked: key not provided."}
