{"role":"designer","task":"food-photo-calories","step":"3","round":2,"status":"done","paths_written":["E:\\projects\\calope\\.team\\food-photo-calories\\design.md","E:\\projects\\calope\\.team\\food-photo-calories\\canvas\\project\\canvas.json","E:\\projects\\calope\\.team\\food-photo-calories\\canvas\\project\\Main.dc.html","E:\\projects\\calope\\docs\\design-system\\README.md","H:\\second-brain\\Projects\\calope\\agents\\designer\\food-photo-calories.md"],"blockers":[{"id":"B-2","problem":"Consent wording is draft (LEGAL-REVIEW); needs legal review before release, not blocking design","ac_ids":["AC-15"],"owner":"PM"}],"quality_checks":{"passed":true,"failed":[]},"brain_note":"H:\\second-brain\\Projects\\calope\\agents\\designer\\food-photo-calories.md","summary":"canvas_format_ready=true: 19 boards converted to Design format (x-dc, inlined CSS, support.js, canvas.json v3). Remaining: publish 3b and tool-based contrast check. Stub app.css/tokens.css left in project/ (no delete tool), unused."}
