{
  "role": "backend-dev",
  "task": "food-photo-calories",
  "step": "4",
  "round": 2,
  "status": "done",
  "paths_written": [
    "E:\\projects\\calope-be\\db\\migrations\\0001_consent_superseded.sql",
    "E:\\projects\\calope-be\\db\\migrations\\0001_consent_superseded.down.sql",
    "E:\\projects\\calope-be\\src\\server\\db\\schema.ts",
    "E:\\projects\\calope-be\\src\\server\\consent.ts",
    "E:\\projects\\calope-be\\src\\app\\api\\consent\\route.ts",
    "E:\\projects\\calope-be\\src\\app\\api\\analyze\\route.ts",
    "E:\\projects\\calope\\.team\\food-photo-calories\\diff-be-r2.patch"
  ],
  "ac_ids_done": ["AC-1", "AC-2", "AC-3", "AC-4", "AC-7", "AC-8", "AC-10", "AC-11", "AC-12", "AC-13", "AC-14", "AC-16", "AC-17", "AC-18", "AC-19", "AC-20", "AC-21", "AC-23", "AC-24"],
  "tests": { "passed": 148, "total": 148 },
  "blockers": [
    { "id": "B-2", "problem": "No SQL path or migration ran against Postgres; live Anthropic call not run (no key).", "ac_ids": ["AC-13", "AC-16", "AC-17", "AC-18"], "owner": "Devops" },
    { "id": "B-5", "problem": "After merging the feature branch, npm test shows 4 failing FE component tests (ConsentPanel x3, PortionStepper x1). BE tests all pass.", "file": "src/components/ConsentPanel.test.tsx", "owner": "FE" }
  ],
  "quality_checks": { "passed": true, "failed": [] },
  "brain_note": "H:\\second-brain\\Projects\\calope\\agents\\backend-dev\\food-photo-calories.md",
  "summary": "D4 done: consent_records.superseded_at with migration 0001_consent_superseded (+down), open-row index on both columns, new-version consent sets superseded_at only. D3 done: shim deleted, routes import src/shared/consent.ts. Origin and health unchanged. BE tests 148/148; tsc clean."
}
