{"role":"devops","task":"food-photo-calories","step":"4","mode":2,"round":7,"status":"blocked","paths_written":["E:\\projects\\calope\\.env.example","E:\\projects\\calope\\.github\\workflows\\ci.yml","E:\\projects\\calope\\package.json","E:\\projects\\calope\\.team\\food-photo-calories\\handoff\\3-devops-r7.json"],"blockers":[{"id":"B-7","problem":"Commit 5c6b0e7 is on ops but the merge into feature/food-photo-calories is refused: uncommitted .team files (checkpoint.md) would be overwritten. Orchestrator must commit them, then merge ops.","owner":"Devops"},{"id":"B-8","problem":"L-3 docs coverage needs a one-word logic change in BE-owned scripts/check-no-thai-food-data.mjs: remove docs from SKIP_DIRS. Tested: still passes with docs scanned.","file":"scripts/check-no-thai-food-data.mjs","owner":"BE"}],"quality_checks":{"passed":false,"failed":["merge into feature not done","docs coverage needs BE change"]},"summary":"L-2 done: .env.example lists all 8 names, FOOD_VISION_MODEL=claude-sonnet-5-5. L-3 wired: npm run check:data plus .github/workflows/ci.yml (check:data, lint, test, build). Build and lint pass on Node 24.21.0 in an ops worktree."}
