{"role":"architect","task":"food-photo-calories","step":"3","round":4,"status":"done","paths_written":["E:\\projects\\calope\\.team\\food-photo-calories\\contract.md","E:\\projects\\calope\\.team\\food-photo-calories\\handoff\\3-architect-r4.json"],"blockers":[{"id":"B-1","problem":"Legal review of ADR 0002 consent wording and USA transfer pending; blocks release, not build","owner":"PM"},{"id":"B-2","problem":"Confirm login provider (Google for MVP) before BE wires auth; ADR 0004 Proposed","owner":"PM"},{"id":"B-3","problem":"Dish pick list for AC-8 has no licensed source; MVP ships free text only, non-blocking","owner":"PM"},{"id":"B-4","problem":"Confirm user-typed dish names showing Thai only satisfies AC-22 after rename, non-blocking","owner":"PM"},{"id":"B-5","problem":"Add superseded_at to consent_records instead of setting withdrawn_at on new-version consent; delete consent-version.ts re-export once FE file merged","owner":"BE","file":"src/server/consent-version.ts","ac_ids":["AC-15","AC-16","AC-18"]}],"quality_checks":{"passed":true,"failed":[]},"brain_note":"H:\\second-brain\\Projects\\calope\\agents\\architect\\food-photo-calories.md","summary":"Round 4 BE deltas: accepted INTERNAL_ERROR 500, 0000_init.sql, strict Origin check (C-ORIGIN), minimal health. Changed D4: use new superseded_at column, not withdrawn_at, so audit separates withdrawal from version change. consent-version.ts re-export accepted as transitional, to be deleted (B-5, BE)."}
