{"role":"devops","task":"food-photo-calories","step":"3","mode":1,"round":1,"status":"done","paths_written":["E:\\projects\\calope\\.team\\food-photo-calories\\deploy.md","E:\\projects\\calope\\.nvmrc","E:\\projects\\calope\\vercel.json","E:\\projects\\calope\\.env.example","H:\\second-brain\\Projects\\calope\\agents\\devops\\food-photo-calories.md"],"blockers":[],"quality_checks":{"passed":true,"failed":[]},"brain_note":"H:\\second-brain\\Projects\\calope\\agents\\devops\\food-photo-calories.md","summary":"Mode 1 done. No deploy targets exist. Pin Node 24.x LTS (24.21.0), Next.js 16.4.0, SDK 0.132.1; Vercel staging (Preview) and production, sin1, rollback via Instant Rollback. Risks: 4.5 MB body limit vs AC-1, no persistence store, local Node is 22.14. Re-verify list for 3d recorded."}
