{"role":"architect","task":"food-photo-calories","step":"3","round":2,"status":"done","paths_written":["E:\\projects\\calope\\.team\\food-photo-calories\\contract.md","E:\\projects\\calope\\.team\\food-photo-calories\\handoff\\3-architect-r2.json"],"blockers":[{"id":"B-1","problem":"Legal review of ADR 0002 consent wording and USA transfer pending; blocks release, not build","owner":"PM"},{"id":"B-2","problem":"Confirm login provider (Google for MVP) before BE wires auth; ADR 0004 Proposed","owner":"PM"},{"id":"B-3","problem":"Dish pick list for AC-8 has no licensed source; MVP ships free text only, non-blocking","owner":"PM"}],"quality_checks":{"passed":true,"failed":[]},"brain_note":"H:\\second-brain\\Projects\\calope\\agents\\architect\\food-photo-calories.md","summary":"Round 2: answered designer Q1-Q6 in contract.md (C-DESIGN-Q). Added dish_index to POST /api/analyze (echoed), message_th for every error code, N - N display rule, free-text dish edit only, known limitation of no meal group id. Runtime still matches deploy.md."}
