{"role":"designer","task":"food-photo-calories","step":"3","round":1,"status":"not-ready","paths_written":["E:\\projects\\calope\\.team\\food-photo-calories\\design.md","E:\\projects\\calope\\.team\\food-photo-calories\\canvas\\project\\canvas.json","E:\\projects\\calope\\.team\\food-photo-calories\\canvas\\project\\Main.dc.html","E:\\projects\\calope\\docs\\design-system\\tokens.css","E:\\projects\\calope\\docs\\design-system\\README.md","H:\\second-brain\\Projects\\calope\\agents\\designer\\food-photo-calories.md"],"blockers":[{"id":"B-1","problem":"Delete-one-meal has no entry point: no meal list in MVP scope; PM/architect to decide","ac_ids":["AC-17"],"owner":"PM"},{"id":"B-2","problem":"Consent wording is draft; legal review needed before release","ac_ids":["AC-15"],"owner":"PM"}],"quality_checks":{"passed":false,"failed":["Canvas not yet published or click-tested (step 3b)","contract.md fields not aligned yet (not present)","Contrast not measured with a tool; no browser test of canvas","Impeccable setup scripts not run (no shell tool)"]},"brain_note":"H:\\second-brain\\Projects\\calope\\agents\\designer\\food-photo-calories.md","summary":"Design system created, 14 phone-first boards (all UI ACs covered), design.md with AC map, flow, specs. Not-ready only for publish, contract alignment and tool-based contrast checks."}
