{"role":"frontend-dev","task":"food-photo-calories","step":"4","round":2,"status":"done","paths_written":["src/components/","src/lib/client/api.ts","src/app/layout.tsx"],"ac_ids_done":["AC-1","AC-2","AC-3","AC-4","AC-5","AC-6","AC-7","AC-8","AC-9","AC-10","AC-11","AC-12","AC-13","AC-14","AC-15","AC-16","AC-17","AC-22","AC-23"],"tests":{"passed":31,"total":31},"blockers":[],"quality_checks":{"passed":true,"failed":[]},"brain_note":"H:\\second-brain\\Projects\\calope\\agents\\frontend-dev\\food-photo-calories.md","summary":"Fixed component tests (missing cleanup, ambiguous query), 3 set-state-in-effect lint errors and the location.assign warning. npm test 31/31, lint clean, tsc and build pass on Node 24.21.0 with BE types from the feature branch."}
